{
    "name": "Gro√üraum-Verkehr Hannover (GVH)",
    "coverage": {
        "realtimeCoverage": {
            "area": {"type":"Polygon","coordinates":[[[9.322671,52.406027],[9.314335,52.417756],[9.292568,52.416543],[9.283495,52.421775],[9.273693,52.420236],[9.259801,52.424207],[9.258173,52.428608],[9.280912,52.434005],[9.280282,52.440548],[9.267594,52.45126],[9.280311,52.458607],[9.270468,52.464897],[9.249891,52.464282],[9.239057,52.469837],[9.242541,52.476011],[9.257383,52.472848],[9.267352,52.476116],[9.260383,52.489125],[9.266358,52.490829],[9.261134,52.503593],[9.268741,52.507587],[9.25965,52.508738],[9.255726,52.517354],[9.248275,52.518081],[9.238688,52.529893],[9.276126,52.547239],[9.318086,52.555245],[9.340315,52.553924],[9.339311,52.557086],[9.347501,52.558716],[9.351426,52.555196],[9.369933,52.561706],[9.37266,52.569105],[9.346479,52.578889],[9.343129,52.581663],[9.345581,52.585384],[9.340716,52.586793],[9.346419,52.591213],[9.341646,52.592482],[9.342706,52.602374],[9.350119,52.601947],[9.354531,52.608213],[9.391018,52.611371],[9.390638,52.618116],[9.425558,52.617038],[9.438936,52.623557],[9.442112,52.632706],[9.454466,52.637732],[9.491447,52.63102],[9.494896,52.634825],[9.504757,52.626246],[9.522889,52.623056],[9.520189,52.62653],[9.531648,52.629852],[9.534981,52.634963],[9.53783,52.645097],[9.534142,52.66253],[9.542527,52.663279],[9.537737,52.665548],[9.539609,52.671415],[9.570348,52.676471],[9.591473,52.675487],[9.587593,52.673793],[9.585249,52.664541],[9.594403,52.663823],[9.589503,52.658226],[9.602836,52.654551],[9.599165,52.646744],[9.620249,52.645397],[9.62143,52.638905],[9.642156,52.633883],[9.634858,52.625494],[9.640262,52.622513],[9.646068,52.608299],[9.643375,52.606035],[9.65122,52.606924],[9.667573,52.600208],[9.698829,52.600105],[9.713611,52.61182],[9.705984,52.619738],[9.713365,52.623564],[9.711594,52.634082],[9.727388,52.633614],[9.734402,52.638093],[9.740185,52.631275],[9.768167,52.629426],[9.775596,52.622144],[9.793253,52.618907],[9.802043,52.614685],[9.800224,52.609775],[9.804535,52.606921],[9.835328,52.60533],[9.822969,52.600477],[9.830808,52.595497],[9.838034,52.597337],[9.847796,52.607911],[9.856133,52.603458],[9.888413,52.603349],[9.880249,52.596933],[9.876935,52.590716],[9.880686,52.589903],[9.907567,52.597391],[9.912503,52.592092],[9.944935,52.586912],[9.952883,52.587449],[9.951604,52.590959],[9.966219,52.590281],[9.969988,52.584957],[9.967125,52.578021],[9.979535,52.577164],[9.980461,52.581403],[9.984688,52.575204],[9.996578,52.576638],[9.989923,52.575393],[9.990569,52.571038],[9.985202,52.571825],[9.98214,52.567027],[9.984126,52.562036],[9.965072,52.553612],[9.966466,52.550206],[9.994856,52.544125],[9.98782,52.536206],[10.0217,52.536763],[10.03407,52.540474],[10.040774,52.535993],[10.059893,52.551806],[10.08115,52.555956],[10.090489,52.562022],[10.111972,52.554638],[10.126649,52.544904],[10.149119,52.538805],[10.141466,52.536977],[10.121203,52.509105],[10.134897,52.498875],[10.141507,52.498035],[10.15644,52.505129],[10.172,52.504249],[10.178606,52.513554],[10.199288,52.507534],[10.201199,52.509815],[10.223391,52.498606],[10.267403,52.488287],[10.271157,52.49374],[10.26764,52.501137],[10.272668,52.509477],[10.287503,52.506621],[10.278482,52.492856],[10.280384,52.489821],[10.271537,52.483526],[10.281499,52.474815],[10.289906,52.473265],[10.294999,52.46619],[10.293019,52.46362],[10.303234,52.45864],[10.299378,52.45568],[10.293703,52.461997],[10.288431,52.462001],[10.286516,52.458682],[10.289772,52.457798],[10.282623,52.453201],[10.294111,52.448613],[10.281599,52.44812],[10.25228,52.436174],[10.254683,52.423742],[10.250267,52.41977],[10.233453,52.427053],[10.20773,52.429155],[10.201955,52.426075],[10.197637,52.407086],[10.180759,52.39604],[10.166644,52.395231],[10.161043,52.399119],[10.130335,52.393928],[10.131293,52.383507],[10.142658,52.380909],[10.143938,52.369815],[10.156299,52.360844],[10.135784,52.357819],[10.136066,52.353645],[10.131122,52.352395],[10.125574,52.354632],[10.133278,52.350015],[10.136436,52.351978],[10.141131,52.351869],[10.13462,52.342969],[10.140329,52.339626],[10.125904,52.337823],[10.132425,52.328582],[10.126128,52.32806],[10.125566,52.322484],[10.118398,52.322143],[10.113465,52.300321],[10.070652,52.298367],[10.069876,52.304096],[10.06111,52.301485],[10.061206,52.294541],[10.039998,52.293716],[10.034127,52.291408],[10.034587,52.283702],[10.017615,52.279988],[9.996119,52.283563],[10.004599,52.290286],[10.006905,52.295409],[10.003444,52.29687],[9.998011,52.289979],[9.972207,52.293851],[9.971122,52.28553],[9.955754,52.286694],[9.951207,52.283673],[9.952007,52.274175],[9.948747,52.27507],[9.948599,52.282592],[9.912906,52.280658],[9.914137,52.267231],[9.90443,52.267527],[9.899811,52.2615],[9.876511,52.262531],[9.872338,52.270245],[9.84852,52.26565],[9.861104,52.255809],[9.860094,52.235569],[9.854217,52.239391],[9.84799,52.23807],[9.84375,52.230787],[9.84026,52.23213],[9.848524,52.242315],[9.848432,52.251256],[9.839458,52.262748],[9.832151,52.265729],[9.791036,52.251526],[9.790794,52.243239],[9.775755,52.239406],[9.776002,52.235014],[9.768918,52.231216],[9.782364,52.232828],[9.790437,52.228867],[9.789223,52.233667],[9.799679,52.2349],[9.80075,52.229703],[9.817214,52.228622],[9.814298,52.214756],[9.817915,52.212998],[9.803396,52.207054],[9.805505,52.20049],[9.802364,52.194709],[9.808036,52.192984],[9.807847,52.192152],[9.802771,52.193169],[9.802513,52.187909],[9.791502,52.190772],[9.792879,52.193096],[9.781782,52.190996],[9.784168,52.187904],[9.777335,52.178037],[9.784246,52.174465],[9.763595,52.170334],[9.762624,52.167312],[9.745139,52.16395],[9.726755,52.168501],[9.720122,52.158191],[9.692988,52.14492],[9.693638,52.135855],[9.67279,52.132489],[9.674697,52.129316],[9.671608,52.128058],[9.660589,52.132891],[9.628118,52.130693],[9.613526,52.13456],[9.613197,52.139097],[9.595921,52.144138],[9.556293,52.167226],[9.525572,52.159796],[9.504368,52.161016],[9.500235,52.168077],[9.496254,52.166683],[9.494244,52.17841],[9.504372,52.187338],[9.506745,52.197157],[9.491648,52.208628],[9.507506,52.204769],[9.516279,52.212187],[9.506853,52.213742],[9.503683,52.222601],[9.507382,52.221772],[9.497132,52.238779],[9.464351,52.255173],[9.455334,52.251637],[9.441537,52.253637],[9.43321,52.260336],[9.443823,52.274939],[9.423723,52.281104],[9.405169,52.299508],[9.396258,52.299027],[9.395208,52.305456],[9.404928,52.30409],[9.406267,52.311645],[9.389383,52.316372],[9.38963,52.321967],[9.363768,52.322576],[9.344728,52.333726],[9.328877,52.32833],[9.331753,52.33819],[9.327151,52.33893],[9.325585,52.353831],[9.322343,52.354205],[9.325041,52.36165],[9.320681,52.368762],[9.329157,52.370874],[9.321006,52.374763],[9.315553,52.384156],[9.315769,52.388186],[9.320354,52.388582],[9.317217,52.397215],[9.322671,52.406027]]]},
            "region": [ "DE-NI" ]
        }
    },
    "options": {
        "endpoint": "https://app.efa.de/mdv_server/app_gvh/",
        "supportedOutputFormats": [ "XML", "JSON" ],
        "xmlOutputFormat": "full"
    },
    "supportedLanguages": [ "de", "en" ],
    "type": {
        "efa": true
    }
}
